{
  "contract_role": "LOOP_REQUIREMENT_COVERAGE_LEDGER",
  "package_id": "PACKAGE_001",
  "project_id": "EXAMPLE_GAME",
  "requirements": [
    {
      "evidence": [
        "E2_TEST"
      ],
      "outputs": [
        "scripts/example.gd"
      ],
      "requirement_id": "REQ_001",
      "status": "MAPPED",
      "tasks": [
        "TASK_001"
      ],
      "tests": [
        "tests/test_example.py"
      ]
    }
  ],
  "schema_version": 1,
  "source_main_sha": "0000000000000000000000000000000000000000",
  "status": "INITIALIZED"
}
